<?xml version="1.0" encoding="utf-8" standalone="no"?><auto_nt_service xmlns:xsi="http://www.w3.org/2001/XMLSchema-instance" xsi:noNamespaceSchemaLocation="XMLSchemadtkug0.xsd">
    
    <cegjegyzek cegid="1" cegjegyzekid="1">
        <bejegyzett_cegek>Stop'n go</bejegyzett_cegek>
    </cegjegyzek>
    <cegjegyzek cegid="2" cegjegyzekid="2">
        <bejegyzett_cegek>Nonstop service</bejegyzett_cegek>
    </cegjegyzek>
    <cegjegyzek cegid="3" cegjegyzekid="3">
        <bejegyzett_cegek>Bosch Car Service</bejegyzett_cegek>
    </cegjegyzek>

    <ceg cegid="1">
        <nev>Stop'n go</nev>
        <szekhely>
            <cim>Miskolc, Soltész Nagy Kálmán utca 36.</cim>
            <telefonszam>46-343-565</telefonszam>
        </szekhely>
    </ceg>
    <ceg cegid="2">
        <nev>Nonstop service</nev>
        <szekhely>
            <cim>Miskolc, Fonoda utca 36.</cim>
            <telefonszam>46-123-414</telefonszam>
        </szekhely>
    </ceg>
    <ceg cegid="3">
        <nev>Bosch Car Service</nev>
        <szekhely>
            <cim>Karcag, Tőkés utca 25.</cim>
            <telefonszam>53-555-100</telefonszam>
        </szekhely>
    </ceg>

    <muhely cegid="1" mid="1">
        <javitando_auto>Fiat Multipla</javitando_auto>
    </muhely>
    <muhely cegid="2" mid="2">
        <javitando_auto>Kia Ceed</javitando_auto>
    </muhely>
    <muhely cegid="3" mid="3">
        <javitando_auto>Honda Civic</javitando_auto>
    </muhely>

    <raktar cikkszam="1">
        <alkatreszek>Kerekcsapagy</alkatreszek>
    </raktar>
    <raktar cikkszam="2">
        <alkatreszek>ECU</alkatreszek>
    </raktar>
    <raktar cikkszam="3">
        <alkatreszek>Motorolaj</alkatreszek>
    </raktar>

    <auto alvazszam="JH4KA4660LC006262" ugyfelid="1">
        <marka>Opel</marka>
        <tipus>Corsa</tipus>
        <km_ora_allasa>250000</km_ora_allasa>
    </auto>
    <auto alvazszam="J8DE5B16477903094" ugyfelid="2">
        <marka>Kia</marka>
        <tipus>Ceed</tipus>
        <km_ora_allasa>98000</km_ora_allasa>
    </auto>
    <auto alvazszam="JH4KA2550HC005889" ugyfelid="3">
        <marka>Honda</marka>
        <tipus>Civic</tipus>
        <km_ora_allasa>250000</km_ora_allasa>
    </auto>

    <tulajdonos ugyfelid="1">
        <nev>Kiss Ramóna</nev>
        <cim>5300 Karcag, Déryné utca 10</cim>
        <szulido>1999.01.01</szulido>
    </tulajdonos>
    <tulajdonos ugyfelid="2">
        <nev>Tóth Fanni</nev>
        <cim>Kiskunfélegyháza, Napsugár út. 50</cim>
        <szulido>1987.10.10</szulido>
    </tulajdonos>
    <tulajdonos ugyfelid="3">
        <nev>Kiss Tamás</nev>
        <cim>3434 Malyi, Rakoczi ut 14.</cim>
        <szulido>1999.01.01</szulido>
    </tulajdonos>

    <futar cikkszam="1" mid="1">
        <varhato_erk>15:15</varhato_erk>
    </futar>
    <futar cikkszam="2" mid="2">
        <varhato_erk>10:00</varhato_erk>
    </futar>
    <futar cikkszam="3" mid="3">
        <varhato_erk>6:00</varhato_erk>
    </futar>

</auto_nt_service>