<?xml version="1.0" encoding="utf-8"?>

<auto_nt_service xmlns:xsi="http://www.w3.org/2001/XMLSchema-instance" xsi:noNamespaceSchemaLocation="XMLSchemadtkug0.xsd">
    
    <cegjegyzek cegid="a" cegjegyzekid="aa">
        <bejegyzett_cegek>Stop'n go</bejegyzett_cegek>
    </cegjegyzek>
    <cegjegyzek cegid="b" cegjegyzekid="bb">
        <bejegyzett_cegek>Stop'n go</bejegyzett_cegek>
    </cegjegyzek>
    <cegjegyzek cegid="c" cegjegyzekid="cc">
        <bejegyzett_cegek>Stop'n go</bejegyzett_cegek>
    </cegjegyzek>

    <ceg cegid="a">
        <nev>Stop'n go</nev>
        <szekhely>
            <cim>Miskolc, Soltész Nagy Kálmán utca 36.</cim>
            <telefonszam>46-343-565</telefonszam>
        </szekhely>
    </ceg>
    <ceg cegid="b">
        <nev>Nonstop service</nev>
        <szekhely>
            <cim>Miskolc, Fonoda utca 36.</cim>
            <telefonszam>46-123-414</telefonszam>
        </szekhely>
    </ceg>
    <ceg cegid="c">
        <nev>Bosch Car Service</nev>
        <szekhely>
            <cim>Karcag, Tőkés utca 25.</cim>
            <telefonszam>53-555-100</telefonszam>
        </szekhely>
    </ceg>

    <muhely cegid="a" mid="m1">
        <javitando_auto>Honda Jazz</javitando_auto>
    </muhely>
    <muhely cegid="b" mid="m2">
        <javitando_auto>Mazda 3</javitando_auto>
    </muhely>
    <muhely cegid="c" mid="m3">
        <javitando_auto>Hyundai i20</javitando_auto>
    </muhely>

    <raktar cikkszam="qwert12">
        <alkatreszek>Injektor</alkatreszek>
    </raktar>
    <raktar cikkszam="xfgje55">
        <alkatreszek>ECU</alkatreszek>
    </raktar>
    <raktar cikkszam="lobdy87">
        <alkatreszek>MAP sensor</alkatreszek>
    </raktar>

    <auto ugyfelid="a1" alvazszam="JH4KA4660LC006262">
        <marka>Honda</marka>
        <tipus>Jazz</tipus>
        <km_ora_allasa>20000</km_ora_allasa>
    </auto>
    <auto ugyfelid="a2" alvazszam="J8DE5B16477903094">
        <marka>Mazda</marka>
        <tipus>3</tipus>
        <km_ora_allasa>98000</km_ora_allasa>
    </auto>
    <auto ugyfelid="a3" alvazszam="JH4KA2550HC005889">
        <marka>Hyundai</marka>
        <tipus>i20</tipus>
        <km_ora_allasa>110000</km_ora_allasa>
    </auto>

    <tulajdonos ugyfelid="a1">
        <nev>Szalai Márton</nev>
        <cim>Miskolc, Felsőruzsin krt. 34</cim>
        <szulido>1999.03.18</szulido>
    </tulajdonos>
    <tulajdonos ugyfelid="a2">
        <nev>Tóth Fanni</nev>
        <cim>Kiskunfélegyháza, Napsugár út. 50</cim>
        <szulido>1987.10.10</szulido>
    </tulajdonos>
    <tulajdonos ugyfelid="a3">
        <nev>Nagy Béla</nev>
        <cim>Berettyóújfalu, Kossuth utca. 10</cim>
        <szulido>1974.01.29</szulido>
    </tulajdonos>

    <futar mid="m1" cikkszam="qwert12">
        <varhato_erk>15:00</varhato_erk>
    </futar>
    <futar mid="m2" cikkszam="xfgje55">
        <varhato_erk>10:00</varhato_erk>
    </futar>
    <futar mid="m3" cikkszam="lobdy87">
        <varhato_erk>6:00</varhato_erk>
    </futar>

</auto_nt_service>